<?xml version="1.0" encoding="UTF-8"?>
<actions xmlns="http://www.ito-global.com/schema/mvc" 
		 xmlns:xsi="http://www.w3.org/2001/XMLSchema-instance"
		 xsi:schemaLocation="http://www.ito-global.com/schema/mvc com/ito-global/schema/mvc/actions-mapping-1.0.xsd  
		 					 http://www.ito-global.com/schema/mvc http://www.ito-global.com/schema/mvc/actions-mapping-1.0.xsd" >

	<action name="/index.html" id="home">
		<controller class="com.ito-global.mvc.defaults.BaseActionControllerImpl" />
		<template name="index.html" path="templates/index.html" />
		<!-- forwards id="navigation">
			<target name="Start" location="/start-operating.html" />
			<target name="Help" location="/help-start-operating.html" />
			<target name="Cancel" location="/index.html" id="navCncl" />
		</forwards-->
	</action>
	
	<action name="/login.html" id="home">
		<controller class="com.ito-global.users.AuthenticationController" 
			method="login" />
		<template name="home.html" path="templates/home.html"/>
		<forwards>
			<target location="registration.html" name="registration" condition="onfailure"/>		
		</forwards>
	</action>	
	
	
	<action name="/registration.html" id="home">
		<controller class="com.ito-global.mvc.defaults.BaseActionControllerImpl" />
		<template name="registration.html" path="templates/registration.html" />
	</action>
	
	<action name="/registr.html" id="home">
		<controller class="com.ito-global.users.RegistrationController" 
			method="registration"/>
		<template name="home.html" path="templates/home.html" />
		<forwards>
			<target location="registration.html" name="registration" condition="onfailure"/>		
		</forwards>
	</action>
	
</actions>