<?xml version="1.0" encoding="UTF-8"?>
<actions xmlns="http://www.ito-global.com/schema/mvc" 
		 xmlns:xsi="http://www.w3.org/2001/XMLSchema-instance"
		 xsi:schemaLocation="http://www.ito-global.com/schema/mvc com/ito-global/schema/mvc/actions-mapping-1.0.xsd  
		 					 http://www.ito-global.com/schema/mvc http://www.ito-global.com/schema/mvc/actions-mapping-1.0.xsd" >

	<action name="/index.html" id="home">
		<controller class="com.itoglobal.mvc.defaults.BaseActionControllerImpl" />
		<template name="index.html" path="templates/layout-two-columns.html" />
		<!-- forwards id="navigation">
			<target name="Start" location="/start-operating.html" />
			<target name="Help" location="/help-start-operating.html" />
			<target name="Cancel" location="/index.html" id="navCncl" />
		</forwards-->
	</action>

	<action name="/schools.html" id="schools">
		<controller class="com.itoglobal.mvc.defaults.BaseActionControllerImpl" />
		<template name="index.html" path="templates/layout-two-columns.html" />	
	</action>

	<action name="/trainings.html" id="trainings">
		<controller class="com.itoglobal.mvc.defaults.BaseActionControllerImpl" />
		<template name="index.html" path="templates/layout-two-columns.html" />	
	</action>

	<action name="/community.html" id="community">
		<controller class="com.itoglobal.mvc.defaults.BaseActionControllerImpl" />
		<template name="index.html" path="templates/layout-two-columns.html" />	
	</action>	

	<action name="/discussions.html" id="discussions">
		<controller class="com.itoglobal.mvc.defaults.BaseActionControllerImpl" />
		<template name="index.html" path="templates/layout-two-columns.html" />	
	</action>	

	<action name="/help.html" id="help">
		<controller class="com.itoglobal.mvc.defaults.BaseActionControllerImpl" />
		<template name="index.html" path="templates/layout-two-columns.html" />	
	</action>

	<action name="/about.html" id="about">
		<controller class="com.itoglobal.mvc.defaults.BaseActionControllerImpl" />
		<template name="index.html" path="templates/layout-two-columns.html" />	
	</action>	
	
	<action name="/overview.html" id="home">
		<controller class="com.itoglobal.mvc.defaults.BaseActionControllerImpl" />
		<template name="index.html" path="templates/layout-two-columns.html" />	
	</action>
	
	<action name="/my-responses.html" id="my-responses">
		<controller class="com.itoglobal.mvc.defaults.BaseActionControllerImpl" />
		<template name="index.html" path="templates/layout-two-columns.html" />	
	</action>
	
	<action name="/valuate-responses.html" id="valuate-responses">
		<controller class="com.itoglobal.mvc.defaults.BaseActionControllerImpl" />
		<template name="index.html" path="templates/layout-two-columns.html" />	
	</action>
	
	<action name="/my-challenges.html" id="my-challenges">
		<controller class="com.itoglobal.mvc.defaults.BaseActionControllerImpl" />
		<template name="index.html" path="templates/layout-two-columns.html" />	
	</action>
	
	<action name="/messages.html" id="messages">
		<controller class="com.itoglobal.mvc.defaults.BaseActionControllerImpl" />
		<template name="index.html" path="templates/layout-two-columns.html" />	
	</action>


	<action name="/login.html" id="login">
		<controller class="com.itoglobal.users.AuthenticationController" 
			method="login" />
		<forwards>
			<target location="/index.html" name="home" condition="onsuccess"/>
			<target location="/login-failed.html" name="login-failed" condition="onfailure"/>		
		</forwards>
	</action>
	
	<action name="/signout.html" id="signout">
		<controller class="com.itoglobal.users.AuthenticationController" 
			method="logout" />
		<forwards>
			<target location="/index.html" name="home" condition="onsuccess"/>
		</forwards>
	</action>
	
	<action name="/login-form.html" id="login-form">
		<controller class="com.itoglobal.mvc.defaults.BaseActionControllerImpl" />
		<template name="index.html" path="templates/views/sidebars/login-form.html"/>
	</action>	

	<action name="/login-failed.html" id="login-failed">
		<controller class="com.itoglobal.mvc.defaults.BaseActionControllerImpl" />
		<template name="index.html" path="templates/layout-one-column.html"/>
	</action>
	
	<action name="/reset-password.html" id="reset-password">
		<controller class="com.itoglobal.users.RegistrationController" method="resetPassword"/>
		<template name="index.html" path="templates/layout-one-column.html"/>
		<forwards>
			<target location="/check-email.html" name="check-email" condition="onsuccess"/>		
		</forwards>
		<property name="template" value="templates/plain/reset-password.txt"/>
	</action>
	
	<action name="/new-password.html" id="new-password">
		<controller class="com.itoglobal.users.RegistrationController" method="resetPassword"/>
		<template name="index.html" path="templates/layout-one-column.html"/>
		<forwards>
			<target location="/login-failed.html" name="login-failed" condition="onsuccess"/>
			<target location="/reset-password.html" name="reset-password" condition="onfailure"/>		
		</forwards>
	</action>
	
	<action name="/check-email.html" id="check-email">
		<controller class="com.itoglobal.mvc.defaults.BaseActionControllerImpl" />
		<template name="index.html" path="templates/layout-one-column.html"/>
	</action>
	
	<action name="/registration.html" id="registration">
		<controller class="com.itoglobal.users.RegistrationController" method="registration"/>
		<template name="index.html" path="templates/layout-one-column.html" />	
		<forwards>
			<target location="registration.html" name="registration" condition="onfailure"/>
			<target location="validation.html" name="validation" condition="onsuccess"/>
		</forwards>
		<property name="template" value="templates/plain/email-confirmation.txt"/>
	</action>

	<action name="/validation.html" id="validation">
		<controller class="com.itoglobal.mvc.defaults.BaseActionControllerImpl" />
		<template name="index.html" path="templates/layout-one-column.html" />	
	</action>
	
	<action name="/confirm-registration.html" id="login-failed">
		<controller class="com.itoglobal.users.RegistrationController" method="registration"/>
		<template name="index.html" path="templates/layout-one-column.html" />
	</action>	

	<action name="/scope.html" id="scope">
		<controller class="com.itoglobal.mvc.defaults.BaseActionControllerImpl" />
		<template name="index.html" path="templates/layout-one-column.html" />	
	</action>

	<action name="/scope-create.html" id="scope-create">
		<controller class="com.itoglobal.scopes.ScopeController" 
			method="createScope"/>
		<template name="scope.html" path="templates/scope.html" />	
	</action>

	<action name="/scope-delete.html" id="scope-delete">
		<controller class="com.itoglobal.scopes.ScopeController" 
			method="deleteScope"/>
		<template name="scope.html" path="templates/scope.html" />	
	</action>
	
	<!-- Sidebar views mapping begin -->
	<action name="/sidebar-*.html" id="sidebar">
		<controller class="com.itoglobal.lcms.controllers.SidebarController" />
		<template name="$1.html" path="templates/views/sidebars/$1.html" />
		<forwards>
			<target location="/login-form.html" name="Login" condition="onsignedoff"/>
		</forwards>
	</action>	
	<!-- Sidebar views mapping end -->	
	
	<!-- Content views mapping begin -->
	<action name="/content-*.html" id="content">
		<controller class="com.itoglobal.lcms.controllers.ContentController" />
		<template name="$1.html" path="templates/views/content/$1.html" />
		<forwards>
			<target location="/home-$1.html" name="home-$1.html" condition="onsignedoff"/>
		</forwards>
	</action>	
	<!-- Content views mapping end -->	
	
	<action name="/home-home.html" id="home-home">
		<controller class="com.itoglobal.mvc.defaults.BaseActionControllerImpl" />
		<template name="index.html" path="templates/views/content/home-content.html"/>
	</action>
	<action name="/home-schools.html" id="home-schools">
		<controller class="com.itoglobal.mvc.defaults.BaseActionControllerImpl" />
		<template name="index.html" path="templates/views/content/home-schools.html"/>
	</action>
	<action name="/home-trainings.html" id="home-trainings">
		<controller class="com.itoglobal.mvc.defaults.BaseActionControllerImpl" />
		<template name="index.html" path="templates/views/content/home-trainings.html"/>
	</action>
	<action name="/home-community.html" id="home-community">
		<controller class="com.itoglobal.mvc.defaults.BaseActionControllerImpl" />
		<template name="index.html" path="templates/views/content/community.html"/>
	</action>
	<action name="/home-discussions.html" id="home-discussions">
		<controller class="com.itoglobal.mvc.defaults.BaseActionControllerImpl" />
		<template name="index.html" path="templates/views/content/discussions.html"/>
	</action>
	<action name="/home-about.html" id="home-about">
		<controller class="com.itoglobal.mvc.defaults.BaseActionControllerImpl" />
		<template name="index.html" path="templates/views/content/about.html"/>
	</action>
	
	
</actions>