<?xml version="1.0" encoding="UTF-8"?>
<actions xmlns="http://www.ito-global.com/schema/mvc" 
		 xmlns:xsi="http://www.w3.org/2001/XMLSchema-instance"
		 xsi:schemaLocation="http://www.ito-global.com/schema/mvc com/ito-global/schema/mvc/actions-mapping-1.0.xsd  
		 					 http://www.ito-global.com/schema/mvc http://www.ito-global.com/schema/mvc/actions-mapping-1.0.xsd" >

	<action name="/index.html" id="home">
		<controller class="com.ito-global.mvc.defaults.BaseActionControllerImpl" />
		<template name="home" path="templates/system/html/index.html" />
	</action>
	
	<action name="/actions-list.html" id="actions-list">
		<controller class="com.ito-global.mvc.defaults.BaseActionControllerImpl" />
		<template name="actions" path="templates/system/xsl/actions-mapping.xsl" type="XSLT">
			<input name="data" value="actions-mapping.xml" type="FILE" />
		</template>
	</action>
	
</actions>