<?xml version="1.0" encoding="UTF-8"?>
<actions xmlns="http://www.ito-global.com/schema/mvc" 
		 xmlns:xsi="http://www.w3.org/2001/XMLSchema-instance"
		 xsi:schemaLocation="http://www.ito-global.com/schema/mvc com/ito-global/schema/mvc/actions-mapping-1.0.xsd  
		 					 http://www.ito-global.com/schema/mvc http://www.ito-global.com/schema/mvc/actions-mapping-1.0.xsd" >

	<action name="/index.html" id="home">
		<controller class="com.itoglobal.mvc.defaults.BaseActionControllerImpl" />
		<template name="index.html" path="templates/layout-two-columns.html" />
		<!-- forwards id="navigation">
			<target name="Start" location="/start-operating.html" />
			<target name="Help" location="/help-start-operating.html" />
			<target name="Cancel" location="/index.html" id="navCncl" />
		</forwards-->
	</action>
	
	<action name="/schools.html" id="schools-browse">
		<controller class="com.itoglobal.mvc.defaults.BaseActionControllerImpl" />
		<template name="index.html" path="templates/layout-two-columns.html" />	
	</action>
	
	<action name="/trainings.html" id="trainings-browse">
		<controller class="com.itoglobal.mvc.defaults.BaseActionControllerImpl" />
		<template name="index.html" path="templates/layout-two-columns.html" />	
	</action>
	
	<action name="/community.html" id="community">
		<controller class="com.itoglobal.mvc.defaults.BaseActionControllerImpl" />
		<template name="index.html" path="templates/layout-two-columns.html" />	
	</action>	
	
	<action name="/discussions.html" id="discussions">
		<controller class="com.itoglobal.mvc.defaults.BaseActionControllerImpl" />
		<template name="index.html" path="templates/layout-two-columns.html" />	
	</action>	
	
	<action name="/help.html" id="help">
		<controller class="com.itoglobal.mvc.defaults.BaseActionControllerImpl" />
		<template name="index.html" path="templates/layout-two-columns.html" />	
	</action>
	
	<action name="/about.html" id="about">
		<controller class="com.itoglobal.mvc.defaults.BaseActionControllerImpl" />
		<template name="index.html" path="templates/layout-two-columns.html" />	
	</action>	
	
	<action name="/login.html" id="login">
		<controller class="com.itoglobal.users.AuthenticationController" 
			method="login" />
		<template name="index.html" path="templates/layout-two-columns.html"/>
		<forwards>
			<target location="registration.html" name="registration" condition="onfailure"/>		
		</forwards>
	</action>
	
	<action name="/registration.html" id="registration">
		<controller class="com.itoglobal.mvc.defaults.BaseActionControllerImpl" />
		<template name="index.html" path="templates/layout-one-column.html" />	
	</action>
	
	<action name="/scoupe.html" id="scoupe">
		<controller class="com.itoglobal.mvc.defaults.BaseActionControllerImpl" />
		<template name="scoupe.html" path="templates/scoupe.html" />	
	</action>
	
	<action name="/scoupe_create.html" id="scoupe">
		<controller class="com.itoglobal.services.ContextService" 
			method="createContext"/>
		<template name="scoupe.html" path="templates/scoupe.html" />	
		<forwards>
			<target location="/home.html" name="scoupe" condition="onfailure"/>		
		</forwards>
	</action>
	
	<action name="/scoupe_delete.html" id="scoupe">
		<controller class="com.itoglobal.services.ContextService" 
			method="deleteContext"/>
		<template name="scoupe.html" path="templates/scoupe.html" />	
		<forwards>
			<target location="/home.html" name="scoupe" condition="onfailure"/>		
		</forwards>
	</action>
</actions>